### ISSUE TITLE
Support proxy during image build

### ISSUE THREAD

**Issue by ghost** [ansible/awx#187]
##### ISSUE TYPE
 - Bug Report

##### COMPONENT NAME
 - Installer

##### SUMMARY
Building awx behind a web proxy. 
Although proxy support has recently implemented [(153)](https://github.com/ansible/awx/pull/153), building base web image fails when trying to download tini executable.

##### STEPS TO REPRODUCE

prerequisites:
 - using an environment where access to web external resources is filtered by a web proxy service

 1. setup your proxy settings in the inventory file:
```
http_proxy=http://proxy:3128
https_proxy=http://proxy:3128
no_proxy=mycorp.org
```
 2. run the installer.yml as usual

or even faster, trying to build this Dockerfile: 
```
FROM centos:7
ENV HTTP_PROXY=http://proxy:3128
ENV HTTPS_PROXY=http://proxy:3128
ENV NO_PROXY=localhost
ENV http_proxy=http://proxy:3128
ENV https_proxy=http://proxy:3128
ENV no_proxy=localhost
ADD https://github.com/krallin/tini/releases/download/v0.14.0/tini /tini
RUN chmod +x /tini
```
while at the same time running a tcpdump: 
`tcpdump -i any -nnl \(host 192.30.253.112 or host 192.30.253.113\) and \(port 443 or port 80\)`

getting the following output:
```
17:34:10.288878 IP 10.30.96.56.41326 > 192.30.253.112.443: Flags [S], seq 3864151997, win 29200, options [mss 1460,sackOK,TS val 190822456 ecr 0,nop,wscale 7], length 0
17:34:12.292845 IP 10.30.96.56.41326 > 192.30.253.112.443: Flags [S], seq 3864151997, win 29200, options [mss 1460,sackOK,TS val 190824460 ecr 0,nop,wscale 7], length 0
17:34:16.296881 IP 10.30.96.56.41326 > 192.30.253.112.443: Flags [S], seq 3864151997, win 29200, options [mss 1460,sackOK,TS val 190828464 ecr 0,nop,wscale 7], length 0
```

##### EXPECTED RESULTS

No failure during the build

##### ACTUAL RESULTS

Playbook execution fails at task:

```
TASK [image_build : Build base web image] **************************************
task path: /builds/4bd472bf/0/awx/awx/installer/image_build/tasks/main.yml:163
Using module file /usr/lib/python2.7/site-packages/ansible/modules/cloud/docker/docker_image.py
<localhost> ESTABLISH LOCAL CONNECTION FOR USER: root
<localhost> EXEC /bin/sh -c 'echo ~ && sleep 0'
<localhost> EXEC /bin/sh -c '( umask 77 && mkdir -p "` echo /root/.ansible/tmp/ansible-tmp-1505639261.46-32672171571478 `" && echo ansible-tmp-1505639261.46-32672171571478="` echo /root/.ansible/tmp/ansible-tmp-1505639261.46-32672171571478 `" ) && sleep 0'
<localhost> PUT /tmp/tmpCsnCKN TO /root/.ansible/tmp/ansible-tmp-1505639261.46-32672171571478/docker_image.py
<localhost> EXEC /bin/sh -c 'chmod u+x /root/.ansible/tmp/ansible-tmp-1505639261.46-32672171571478/ /root/.ansible/tmp/ansible-tmp-1505639261.46-32672171571478/docker_image.py && sleep 0'
<localhost> EXEC /bin/sh -c '/usr/bin/env python /root/.ansible/tmp/ansible-tmp-1505639261.46-32672171571478/docker_image.py; rm -rf "/root/.ansible/tmp/ansible-tmp-1505639261.46-32672171571478/" > /dev/null 2>&1 && sleep 0'
fatal: [localhost -> localhost]: FAILED! => {
    "changed": false, 
    "failed": true, 
    "invocation": {
        "module_args": {
            "api_version": null, 
            "archive_path": null, 
            "buildargs": {
                "http_proxy": "http://proxy:3128", 
                "https_proxy": "http://proxy:3128", 
                "no_proxy": "127.0.0.1"
            }, 
            "cacert_path": null, 
            "cert_path": null, 
            "container_limits": null, 
            "debug": false, 
            "docker_host": null, 
            "dockerfile": "Dockerfile", 
            "filter_logger": false, 
            "force": false, 
            "http_timeout": null, 
            "key_path": null, 
            "load_path": null, 
            "name": "awx_web", 
            "nocache": "False", 
            "path": "/tmp/docker-image", 
            "pull": true, 
            "push": false, 
            "repository": null, 
            "rm": true, 
            "ssl_version": null, 
            "state": "present", 
            "tag": "1.0.0.395", 
            "timeout": null, 
            "tls": null, 
            "tls_hostname": null, 
            "tls_verify": null, 
            "use_tls": "no"
        }
    }, 
    "msg": "Error building awx_web - code: None, message: ADD failed: Get https://github.com/krallin/tini/releases/download/v0.14.0/tini: dial tcp 192.30.253.112:443: i/o timeout, logs: [u'Step 1/31 : FROM centos:7\\n', u' ---> 196e0ce0c9fb\\n', u'Step 2/31 : USER root\\n', u' ---> Running in 9737dc6f9c32\\n', u' ---> ab7277dc94ad\\n', u'Removing intermediate container 9737dc6f9c32\\n', u'Step 3/31 : ADD https://github.com/krallin/tini/releases/download/v0.14.0/tini /tini\\n']"
}
```

During the install.yml playbook execution, running a tcpdump on the docker host confirms the assumption:
```
# tcpdump -i any -nnl \(host 192.30.253.112 or host 192.30.253.113\) and \(port 443 or port 80\)
tcpdump: verbose output suppressed, use -v or -vv for full protocol decode
listening on any, link-type LINUX_SLL (Linux cooked), capture size 65535 bytes
17:25:04.960825 IP 192.168.0.10.38696 > 192.30.253.113.443: Flags [S], seq 4171268317, win 29200, options [mss 1460,sackOK,TS val 160582901 ecr 0,nop,wscale 7], length 0
17:25:05.963627 IP 192.168.0.10.38696 > 192.30.253.113.443: Flags [S], seq 4171268317, win 29200, options [mss 1460,sackOK,TS val 160583904 ecr 0,nop,wscale 7], length 0
17:25:07.967663 IP 192.168.0.10.38696 > 192.30.253.113.443: Flags [S], seq 4171268317, win 29200, options [mss 1460,sackOK,TS val 160585908 ecr 0,nop,wscale 7], length 0
...
```

##### ADDITIONAL INFORMATION

My workaround:

 - patch the file [Dockerfile.j2] (https://github.com/ansible/awx/blob/devel/installer/image_build/templates/Dockerfile.j2) as follow:

```
diff --git a/installer/image_build/templates/Dockerfile.j2 b/installer/image_build/templates/Dockerfile.j2
index ba37539..c3e3bda 100644
--- a/installer/image_build/templates/Dockerfile.j2
+++ b/installer/image_build/templates/Dockerfile.j2
@@ -9,8 +9,8 @@ FROM centos:7
 USER root
 
 # Init System
-ADD https://github.com/krallin/tini/releases/download/v0.14.0/tini /tini
-RUN chmod +x /tini
+RUN curl -L  -o /tini https://github.com/krallin/tini/releases/download/v0.14.0/tini && \
+    chmod +x /tini
 
 ADD Makefile /tmp/Makefile
 RUN mkdir /tmp/requirements
```

Is anyone able to reproduce the same ? Anyone interested by merging those changes ? Any better idea ?

Thanks
Franck

**Comment by truestory1** [comment]
I've done the deployment this way

```
diff -crN awx-orig/installer/image_build/tasks/main.yml awx/installer/image_build/tasks/main.yml
*** awx-orig/installer/image_build/tasks/main.yml       2017-09-12 13:50:45.180289041 +0000
--- awx/installer/image_build/tasks/main.yml    2017-09-12 11:07:37.300289041 +0000
***************
*** 53,58 ****
--- 53,61 ----
      dockerfile: Dockerfile.sdist
      name: awx_sdist_builder
      tag: "{{ awx_version }}"
+     buildargs:
+         http_proxy: http://PROXY:80
+         https_proxy: http://PROXY:80
      force: true

  - name: Build AWX distribution
***************
*** 62,68 ****
      state: started
      detach: false
      volumes:
!       - ../:/awx:Z

  - name: Set docker build base path
    set_fact:
--- 65,75 ----
      state: started
      detach: false
      volumes:
!       - ../:/awx
!     env:
!         http_proxy: http://PROXY:80
!         https_proxy: http://PROXY:80
!

  - name: Set docker build base path
    set_fact:
***************
*** 156,161 ****
--- 163,171 ----
      dockerfile: Dockerfile
      name: "{{ awx_web_image }}"
      tag: "{{ awx_version }}"
+     buildargs:
+         http_proxy: http://PROXY:80
+         https_proxy: http://PROXY:80
    delegate_to: localhost

  - name: Build base task image
```

**Comment by alexander-bauer** [comment]
I encountered the same issue, and replaced the `ADD` directive with
```
RUN curl -L -o /tini https://github.com/krallin/tini/releases/download/v0.14.0/tini
```
This obeys the buildargs.
