### ISSUE TITLE
API provisioning callback jobs do not work behind proxy/load balancer

### ISSUE THREAD

**Issue by savealive** [ansible/awx#562]
##### ISSUE TYPE

 - Bug Report

##### COMPONENT NAME

 - API

##### SUMMARY
Could not run provisioning callback jobs when using loadbalancer IP/host. 
`$ curl --data "host_config_key=ac2960188ddd70b965fedcd037b57732" https://tower.staging.hcom:443/api/v2/job_templates/24/callback/ -XPOST
{"msg":"No matching host could be found!"}`

where https://tower.staging.hcom:443 is load-balancer VIP
Necessary REMOTE_HOST_HEADERS are set correctly.

##### ENVIRONMENT
* AWX version: 1.0.1-143
* AWX install method: docker on linux
* Ansible version:  2.4
* Operating System: Linux
* Web Browser: curl

##### STEPS TO REPRODUCE
Run callback job using LB host

##### EXPECTED RESULTS
Callback job is executed successfully basing on "REMOTE_ADDR" HTTP header. 

##### ACTUAL RESULTS

Run job using LP IP-address:
`$ curl --data "host_config_key=ac2960188ddd70b965fedcd037b57731" https://tower.staging.hcom:443/api/v2/job_templates/24/callback/ -XPOST
{"msg":"No matching host could be found!"}`

Actual HTTP header which is sent from LB:

> POST /api/v2/job_templates/24/callback/ HTTP/1.1
> User-Agent: curl/7.29.0
> Host: tower.staging.hcom
> Accept: */*
> Content-Length: 48
> Content-Type: application/x-www-form-urlencoded
> REMOTE_ADDR: 10.187.106.161
> host_config_key=ac2960188ddd70b965fedcd037b57731
> 11:33:56.249775 IP 10.187.64.17.51905 > 10.187.65.120.http: Flags [.], ack 1424990846, win 8190, length 0

AWX settings:
`    "REMOTE_HOST_HEADERS": [
        "True-Client-IP",
        "REMOTE_ADDR",
        "REMOTE_HOST"
    ],`

So, LB correctly sets REMOTE_ADDR header which is configured in AWX system settings - "REMOTE HOST HEADERS" but AWX still rejects such callback job execution.

Logs:
`2017-11-02 16:41:51,837 WARNING  awx.api.generics status 400 received by user AnonymousUser attempting to access /api/v2/job_templates/24/callback/ from 10.187.64.17
10.187.64.17 - - [02/Nov/2017:16:41:51 +0000] "POST /api/v2/job_templates/24/callback/ HTTP/1.1" 400 53 "-" "curl/7.29.0" "-"
[pid: 318|app: 0|req: 795/24358] 10.187.64.17 () {36 vars in 530 bytes} [Thu Nov  2 16:41:51 2017] POST /api/v2/job_templates/24/callback/ => generated 42 bytes in 60 msecs (HTTP/1.1 400) 6 headers in 191 bytes (1 switches on core 0)`

where 10.187.64.17 is LB address, not actual client address.

When calling AWX host directly everything works fine (AWX recognizes remote host as one from inventory):

`curl --data "host_config_key=ac2960188ddd70b965fedcd037b57732" http://chhlapphot830/api/v2/job_templates/24/callback/`

`10.187.106.161 - - [02/Nov/2017:16:44:43 +0000] "POST /api/v2/job_templates/24/callback/ HTTP/1.1" 201 5 "-" "curl/7.29.0" "-"
[pid: 404|app: 0|req: 61/24393] 10.187.106.161 () {36 vars in 527 bytes} [Thu Nov  2 16:44:42 2017] POST /api/v2/job_templates/24/callback/ => generated 0 bytes in 227 msecs (HTTP/1.1 201) 6 headers in 204 bytes (1 switches on core 0)
[pid: 376|app: 0|req: 234/24394] 10.187.64.17 () {46 vars in 2333 bytes} [Thu Nov  2 16:44:44 2017] GET /api/v2/dashboard/graphs/jobs/?period=month&job_type=all => generated 1126 bytes in 49 msecs (HTTP/1.1 200) 7 headers in 202 bytes (1 switches on core 0)`

**Comment by matburt** [comment]
I think you'll probably need to set X-Forwarded-For and its ilk also: http://docs.ansible.com/ansible-tower/latest/html/administration/proxy-support.html#configure-known-proxies

**Comment by savealive** [comment]
@matburt Proxy whitelist is enabled:
`{
    "ACTIVITY_STREAM_ENABLED": true,
    "ACTIVITY_STREAM_ENABLED_FOR_INVENTORY_SYNC": false,
    "ORG_ADMINS_CAN_SEE_ALL_USERS": true,
    "TOWER_ADMIN_ALERTS": true,
    "TOWER_URL_BASE": "https://tower.staging.hcom",
    "REMOTE_HOST_HEADERS": [
        "HTTP_X_FORWARDED_FOR"
    ],
    "PROXY_IP_WHITELIST": [
        "10.187.64.17"
    ]
}`

10.187.64.17 there is the IP from which LB sends requests to AWX.

**Comment by matburt** [comment]
In your header output above I didn't see X-Forwarded-For being sent from the LB?

**Comment by savealive** [comment]
@matburt Sorry, maybe info in logs was not actual as I've been trying to test various config combinations. 
So,
**Current config is following:**
> {
>     "ACTIVITY_STREAM_ENABLED": true,
>     "ACTIVITY_STREAM_ENABLED_FOR_INVENTORY_SYNC": false,
>     "ORG_ADMINS_CAN_SEE_ALL_USERS": true,
>     "TOWER_ADMIN_ALERTS": true,
>     "TOWER_URL_BASE": "https://tower.staging.hcom",
>     "REMOTE_HOST_HEADERS": [
>         "HTTP_X_FORWARDED_FOR",
>         "REMOTE_ADDR",
>         "REMOTE_HOST"
>     ],
>     "PROXY_IP_WHITELIST": [
>         "10.187.64.17",
>         "10.184.5.222"
>     ],
>     "LICENSE": {}
> }

**Curl request is:** 
> $ curl --data "host_config_key=ac2960188ddd70b965fedcd037b57732" https://tower.staging.hcom:443/api/v2/job_templates/24/callback/
> {"msg":"No matching host could be found!"}

**LB sends following HTTP headers (tcpdump output):**

> 95180374, win 40958, length 272: HTTP: POST /api/v2/job_templates/24/callback/ HTTP/1.1
> E..8V......4
> .@.
> .Ax...P..>"...VP.......POST /api/v2/job_templates/24/callback/ HTTP/1.1
> User-Agent: curl/7.29.0
> Host: tower.staging.hcom
> Accept: */*
> Content-Length: 48
> Content-Type: application/x-www-form-urlencoded
> HTTP_X_FORWARDED_FOR: 10.187.106.161
> 
> host_config_key=ac2960188ddd70b965fedcd037b57732

**And log from awx_web:** 

> 2017-11-06 18:17:43,389 WARNING  awx.api.generics status 400 received by user AnonymousUser attempting to access /api/v2/job_templates/24/callback/ from 10.187.64.17
> 10.187.64.17 - - [06/Nov/2017:18:17:43 +0000] "POST /api/v2/job_templates/24/callback/ HTTP/1.1" 400 53 "-" "curl/7.29.0" "-"
> [pid: 463|app: 0|req: 139/39236] 10.187.64.17 () {36 vars in 529 bytes} [Mon Nov  6 18:17:43 2017] POST /api/v2/job_templates/24/callback/ => generated 42 bytes in 129 msecs (HTTP/1.1 400) 6 headers in 191 bytes (1 switches on core 0)

# **At same time, direct AWX host call works fine:**
**Curl request:**

> $ curl --data "host_config_key=ac2960188ddd70b965fedcd037b57732" http://chhlapphot830/api/v2/job_templates/24/callback/

**Headers:**

> $ tcpdump -n -S -s 0 -A 'tcp dst port 80' | grep -B3 -A10 "POST /api/v2/job_templates/24/callback/"
> tcpdump: verbose output suppressed, use -v or -vv for full protocol decode
> listening on eth0, link-type EN10MB (Ethernet), capture size 262144 bytes
> .j.
> .Ax...P..4..zL-...._......
> ....=E'.
> 12:23:40.854688 IP 10.187.106.161.49078 > 10.187.65.120.http: Flags [P.], seq 3157144578:3157144806, ack 477776941, win 229, options [nop,nop,TS val 3247641888 ecr 1027942345], length 228: HTTP: POST /api/v2/job_templates/24/callback/ HTTP/1.1
> E...!!@.?.X0
> .j.
> .Ax...P..4..zL-...........
> ... =E'.POST /api/v2/job_templates/24/callback/ HTTP/1.1
> User-Agent: curl/7.29.0
> Host: chhlapphot830
> Accept: */*
> Content-Length: 48
> Content-Type: application/x-www-form-urlencoded
> 
> host_config_key=ac2960188ddd70b965fedcd037b57732
> 12:23:41.268502 IP 10.187.106.161.49078 > 10.187.65.120.http: Flags [.], ack 477777306, win 237, options [nop,nop,TS val 3247642301 ecr 1027942760], length 0
> E..4!"@.?.Y.
> .j.
> ^C22 packets captured
> 

**Logs:**

> [pid: 454|app: 0|req: 108/39309] 10.187.106.161 () {36 vars in 527 bytes} [Mon Nov  6 18:23:40 2017] POST /api/v2/job_templates/24/callback/ => generated 0 bytes in 413 msecs (HTTP/1.1 201) 6 headers in 204 bytes (1 switches on core 0)
> 10.187.106.161 - - [06/Nov/2017:18:23:41 +0000] "POST /api/v2/job_templates/24/callback/ HTTP/1.1" 201 5 "-" "curl/7.29.0" "-"

**Comment by matburt** [comment]
`HTTP_X_FORWARDED_FOR` This is *not* what the x-forwarded-for header is supposed to look like. AWS has some good documentation on this:

http://docs.aws.amazon.com/elasticloadbalancing/latest/classic/x-forwarded-headers.html

**Comment by savealive** [comment]
@matburt Finally got it working. My bad. I was expecting it just should match two strings: header name in system config and header name in request. But no, awx prepends header with HTTP_, converts to uppercase and replaces "-" by "_".
So, for example, custom header True-Client-IP will be converted into HTTP_TRUE_CLIENT_IP, so in AWX system config we have to specify HTTP_TRUE_CLIENT_IP.
