### ISSUE TITLE
splunk logging is not working with ansible awx 

### ISSUE THREAD

**Issue by gefela** [ansible/awx#7547]
##### ISSUE TYPE
 - Bug Report

##### SUMMARY
After setting the splunk logging at the AWX UI, i am not able to see any logs at the splunk interface.

##### ENVIRONMENT
* AWX version: 12.0.0
* AWX install method: ansible awx with Linux/ docker 
* Ansible version:  2.9.9
* Operating System: Centos 8 
* Web Browser: Firefox

##### STEPS TO REPRODUCE

In System settings / logging tab fill setup form with

    logging collector ip/fqdn
    logging collector type : Splunk
    logging collector password : Token from Splunk HEC setup console
    logs to be sent : awx, activity_stream, job_events, system_tracking
    logging collector protocol : HTTP/HTTPS

##### EXPECTED RESULTS
Then save changes and activate external logging by checking 'Enable external logging' option

Click on 'TEST' button to send test event to Splunk collector.
Try to launch a test playbook to confirm there is nothing logged in Splunk.

Log events are expected in Splunk console from the right event collector. 

##### ACTUAL RESULTS
No event found at all in Splunk console for defined event collector.

##### ADDITIONAL INFORMATION
[root@localhost /]# tcpdump port 8088
tcpdump: verbose output suppressed, use -v or -vv for full protocol decode
listening on veth1223a06, link-type EN10MB (Ethernet), capture size 262144 bytes
10:53:33.099119 IP 172.18.0.5.50672 > 172.16.203.72.radan-http: Flags [S], seq 642530734, win 29200, options [mss 1460,sackOK,TS val 860407188 ecr 0,nop,wscale 7], length 0
10:53:33.099780 IP 172.16.203.72.radan-http > 172.18.0.5.50672: Flags [S.], seq 2445605050, ack 642530735, win 28960, options [mss 1460,sackOK,TS val 3443920951 ecr 860407188,nop,wscale 7], length 0
10:53:33.099850 IP 172.18.0.5.50672 > 172.16.203.72.radan-http: Flags [.], ack 1, win 229, options [nop,nop,TS val 860407189 ecr 3443920951], length 0
10:53:33.129677 IP 172.18.0.5.50672 > 172.16.203.72.radan-http: Flags [P.], seq 1:518, ack 1, win 229, options [nop,nop,TS val 860407219 ecr 3443920951], length 517
10:53:33.130831 IP 172.16.203.72.radan-http > 172.18.0.5.50672: Flags [.], ack 518, win 235, options [nop,nop,TS val 3443920982 ecr 860407219], length 0
10:53:33.131097 IP 172.16.203.72.radan-http > 172.18.0.5.50672: Flags [P.], seq 1:146, ack 518, win 235, options [nop,nop,TS val 3443920982 ecr 860407219], length 145
10:53:33.131367 IP 172.18.0.5.50672 > 172.16.203.72.radan-http: Flags [.], ack 146, win 237, options [nop,nop,TS val 860407220 ecr 3443920982], length 0
10:53:33.135808 IP 172.18.0.5.50672 > 172.16.203.72.radan-http: Flags [P.], seq 518:569, ack 146, win 237, options [nop,nop,TS val 860407225 ecr 3443920982], length 51
10:53:33.136129 IP 172.18.0.5.50672 > 172.16.203.72.radan-http: Flags [P.], seq 569:1027, ack 146, win 237, options [nop,nop,TS val 860407225 ecr 3443920982], length 458
10:53:33.137422 IP 172.16.203.72.radan-http > 172.18.0.5.50672: Flags [.], ack 1027, win 243, options [nop,nop,TS val 3443920989 ecr 860407225], length 0
10:53:33.137535 IP 172.16.203.72.radan-http > 172.18.0.5.50672: Flags [P.], seq 146:417, ack 1027, win 243, options [nop,nop,TS val 3443920989 ecr 860407225], length 271
10:53:33.138289 IP 172.16.203.72.radan-http > 172.18.0.5.50672: Flags [P.], seq 417:504, ack 1027, win 243, options [nop,nop,TS val 3443920990 ecr 860407225], length 87
10:53:33.143328 IP 172.16.203.72.radan-http > 172.18.0.5.50672: Flags [P.], seq 417:504, ack 1027, win 243, options [nop,nop,TS val 3443920994 ecr 860407225], length 87
10:53:33.143364 IP 172.18.0.5.50672 > 172.16.203.72.radan-http: Flags [.], ack 504, win 245, options [nop,nop,TS val 860407233 ecr 3443920989,nop,nop,sack 1 {417:504}], length 0
10:53:33.145750 IP 172.18.0.5.50672 > 172.16.203.72.radan-http: Flags [P.], seq 1027:1058, ack 504, win 245, options [nop,nop,TS val 860407235 ecr 3443920989], length 31
10:53:33.146767 IP 172.18.0.5.50672 > 172.16.203.72.radan-http: Flags [R.], seq 1058, ack 504, win 245, options [nop,nop,TS val 860407236 ecr 3443920989], length 0

The docker ip address is  

root@localhost /]# ifconfig docker0
docker0: flags=4099<UP,BROADCAST,MULTICAST>  mtu 1500
        inet 172.17.0.1  netmask 255.255.0.0  broadcast 172.17.255.255
        ether 02:42:d1:b3:2b:df  txqueuelen 0  (Ethernet)
        RX packets 0  bytes 0 (0.0 B)
        RX errors 0  dropped 0  overruns 0  frame 0
        TX packets 0  bytes 0 (0.0 B)
        TX errors 0  dropped 0 overruns 0  carrier 0  collisions 0

**Comment by ryanpetrello** [comment]
@gefela do you see any clues in:

`/var/log/tower/rsyslog.err`

**Comment by gefela** [comment]
None . The directory does not exist.

**Comment by ryanpetrello** [comment]
If I misconfigure Splunk, it works for me:

```shell
~/dev/awx/installer docker ps -a
CONTAINER ID        IMAGE                COMMAND                  CREATED             STATUS              PORTS                  NAMES
4a4631570ee9        ansible/awx:13.0.0   "tini -- /usr/bin/la…"   3 minutes ago       Up 3 minutes        8052/tcp               awx_task
58fc3f3aac14        ansible/awx:13.0.0   "tini -- /bin/sh -c …"   3 minutes ago       Up 3 minutes        0.0.0.0:80->8052/tcp   awx_web
8f4ee95558ee        postgres:10          "docker-entrypoint.s…"   3 minutes ago       Up 3 minutes        5432/tcp               awx_postgres
63087724a5e6        redis                "docker-entrypoint.s…"   3 minutes ago       Up 3 minutes        6379/tcp               awx_redis
~/dev/awx/installer docker exec -it 58fc3f3aac14 bash -c "ls -la /var/log/tower"
total 16
drwxrwxr-x 1 root root 4096 Jul  7 16:46 .
drwxr-xr-x 1 root root 4096 Jun 23 19:11 ..
-rw-r--r-- 1 root root    0 Jul  7 16:46 dispatcher.log
-rw-r--r-- 1 root root 1624 Jul  7 16:48 wsbroadcast.log
~/dev/awx/installer docker exec -it 4a4631570ee9 bash -c "ls -la /var/log/tower"
total 16
drwxrwxr-x 1 root root 4096 Jul  7 16:46 .
drwxr-xr-x 1 root root 4096 Jun 23 19:11 ..
-rw-r--r-- 1 root root  831 Jul  7 16:49 dispatcher.log
-rw-r--r-- 1 root root    0 Jul  7 16:46 wsbroadcast.log
```

![image](https://user-images.githubusercontent.com/214912/86815522-c009b600-c050-11ea-8ef5-2ab437853f47.png)

```shell 
~ docker exec -it 58fc3f3aac14 bash -c "cat /var/log/tower/rsyslog.err"
{ "request": { "url": "http:\/\/localhost:9999\/", "postdata": "{\"event\": {\"@timestamp\": \"2020-07-07T16:52:16.977Z\", \"message\": \"AWX Connection Test Message\", \"host\": \"awxweb\", \"level\": \"ERROR\", \"logger_name\": \"awx\", \"stack_info\": null, \"cluster_host_id\": \"awx\", \"tower_uuid\": null}}" }, "response": { "status": 0, "message": "NULL: curl request failed or no response" } }
{ "request": { "url": "http:\/\/localhost:9999\/", "postdata": "{\"event\": {\"@timestamp\": \"2020-07-07T16:52:16.977Z\", \"message\": \"AWX Connection Test Message\", \"host\": \"awxweb\", \"level\": \"ERROR\", \"logger_name\": \"awx\", \"stack_info\": null, \"cluster_host_id\": \"awx\", \"tower_uuid\": null}}" }, "response": { "status": 0, "message": "NULL: curl request failed or no response" } }
{ "request": { "url": "http:\/\/localhost:9999\/", "postdata": "{\"event\": {\"@timestamp\": \"2020-07-07T16:52:16.977Z\", \"message\": \"AWX Connection Test Message\", \"host\": \"awxweb\", \"level\": \"ERROR\", \"logger_name\": \"awx\", \"stack_info\": null, \"cluster_host_id\": \"awx\", \"tower_uuid\": null}}" }, "response": { "status": 0, "message": "NULL: curl request failed or no response" } }
{ "request": { "url": "http:\/\/localhost:9999\/", "postdata": "{\"event\": {\"@timestamp\": \"2020-07-07T16:52:16.977Z\", \"message\": \"AWX Connection Test Message\", \"host\": \"awxweb\", \"level\": \"ERROR\", \"logger_name\": \"awx\", \"stack_info\": null, \"cluster_host_id\": \"awx\", \"tower_uuid\": null}}" }, "response": { "status": 0, "message": "NULL: curl request failed or no response" } }
```

**Comment by gefela** [comment]
I have got the logs and the test to splunk is working 
![AWX splunk](https://user-images.githubusercontent.com/30554569/86818806-bd25ba00-c07e-11ea-826e-d41c249e997a.png)


https://pastebin.com/8PRhPAj1

**Comment by ryanpetrello** [comment]
```
{ "request": { "url": "http:\/\/172.16.203.202:8088\/services\/collector\/event", "postdata": "{\"event\": {\"@timestamp\": \"2020-07-04T07:54:56.146Z\", \"message\": \"scaling up worker pid:116\", \"host\": \"awx\", \"level\": \"WARNING\", \"logger_name\": \"awx.main.commands.run_callback_receiver\", \"stack_info\": null, \"cluster_host_id\": \"awx\", \"tower_uuid\": null}}" }, "response": { "status": 0, "message": "NULL: curl request failed or no response" } }
```

This tells me that your Splunk instance is not reachable at `172.16.203.202:8088` from within the container.

**Comment by gefela** [comment]
It is on the same LAN . rst on the last packet 
![AWX wireshark](https://user-images.githubusercontent.com/30554569/86826473-b308b900-c088-11ea-8022-afd953c49ca3.png)

**Comment by gefela** [comment]
what do I need to look for to resolve this

**Comment by ryanpetrello** [comment]
Hey @gefala,

I'm not familiar with your setup, and don't know - you'll have to troubleshoot connectivity from your AWX containers to the IP where you're running Splunk.

Inside both the web and task containers, are you able to verify that connectivity exists using something like netcat?

```
nc -vz 172.16.203.202 8088
```

If not, there's some sort of networking issue you'll need to work out with your Docker setup.
