### ISSUE TITLE
Unable to save any forms

### ISSUE THREAD

**Issue by craph** [ansible/awx#6460]
##### ISSUE TYPE
 - Bug Report

##### SUMMARY

I'm unable to save any forms in AWX 9.3.0.
When I try to click on the save button to create a new sample project or add LDAP authencatication I have a status code 504.  And the form is never saved.

##### ENVIRONMENT
* AWX version: 9.3.0
* AWX install method: docker on linux
* Ansible version:  2.9.5
* Operating System: CentOS 7.7
* Web Browser: Chrome and Chrome in private

##### STEPS TO REPRODUCE

Create a new project sample and click save

##### EXPECTED RESULTS

The form should be saved

##### ACTUAL RESULTS

Failed to create new project. POST returned status: 504

##### ADDITIONAL INFORMATION

In the logs I can see : 
`awx_web      | 2020/03/27 14:23:31 [error] 122#0: *47 upstream timed out (110: Connection timed out) while reading response header from upstream, client: 10.204.35.76, server: _, request: "GET /websocket/ HTTP/1.1", upstream: "http://127.0.0.1:8051/websocket/", host: "myserver:82"
`
And in the browser console I have : 
```
Failed to load resource: the server responded with a status of 504 (Gateway Time-out)
WebSocket connection to 'ws://myserver:82/websocket/' failed: WebSocket opening handshake 
timed out
```

**Comment by StepBee** [comment]
Same AWX and ansible version, running on Ubuntu 18.04.4 LTS (and later on CentOS 8)
Installation via docker-compose.
Exactly the same problem.

Trying to create a new project with a gitlab or github repo brings the error and fails.
Git credentials are SSH private key with passphrase, which were doublechecked from outside AWX.

Trying to delete a project which was half-created with the timeout before brings the error.

`2020/03/28 19:15:40 [error] 122#0: *340 upstream timed out (110: Connection timed out) while reading response header from upstream, client: 79.205.34.6, server: _, request: "GET /websocket/ HTTP/1.1", upstream: "http://127.0.0.1:8051/websocket/", host: "xx.yy.zz"`

```
2020-03-28 14:13:01,908 DEBUG    awx.main.dispatch publish awx.main.scheduler.tasks.run_task_manager(da8bcb25-600f-46ec-9ac6-1509f1a71ee5, queue=awx_private_queue)
RESULT 2
OKREADY
79.205.34.6 - - [28/Mar/2020:14:15:00 +0000] "POST /api/v2/projects/ HTTP/1.1" 504 578 "http://xx.yy.zz/" "Mozilla/5.0 (Macintosh; Intel Mac OS X 10_15_3) AppleWebKit/537.36 (KHTML, like Gecko) Chrome/80.0.3987.149 Safari/537.36" "-"
RESULT 2
OKREADY
2020/03/28 14:15:00 [error] 123#0: *1159 upstream timed out (110: Connection timed out) while reading response header from upstream, client: 79.205.56.6, server: _, request: "POST /api/v2/projects/ HTTP/1.1", upstream: "uwsgi://127.0.0.1:8050", host: "xx.yy.zz", referrer: "http://xx.yyy.zz/"
Sat Mar 28 14:15:01 2020 - *** HARAKIRI ON WORKER 3 (pid: 351, try: 1) ***
Sat Mar 28 14:15:01 2020 - HARAKIRI !!! worker 3 status !!!
Sat Mar 28 14:15:01 2020 - HARAKIRI [core 0] 79.205.34.6 - POST /api/v2/projects/ since 1585404780
Sat Mar 28 14:15:01 2020 - HARAKIRI !!! end of worker 3 status !!!
DAMN ! worker 3 (pid: 351) died, killed by signal 9 :( trying respawn ...
Respawned uWSGI worker 3 (new pid: 375)
WSGI app 0 (mountpoint='') ready in 3 seconds on interpreter 0xee94e0 pid: 375 (default app)
```

I did try most of the recommendations in [this](https://github.com/unbit/uwsgi/issues/1623) issue
- double CPU and memory resources
- increasing timeouts from 120 to 360 (for uwsgi and in nginx.conf)
- remove --master
- change processes from 5 to 1
- add --threaded-logger
None of these ideas helped.

In the meantime, i setup a new installation on CentOS 8 and tried adding a project with a git repository on gitlab and github to eleminate any distro or git hoster specific failures.

Interesting enough, the timeout log message is gone for
`172.18.0.1 - - [29/Mar/2020:13:05:26 +0000] "GET /websocket/ HTTP/1.1" 499 0 "-" "Mozilla/5.0 (Macintosh; Intel Mac OS X 10_15_3) AppleWebKit/537.36 (KHTML, like Gecko) Chrome/80.0.3987.149 Safari/537.36" "-"`

But adding a project is still no success - exactly the same error.

The error when deleting such a failed project is quite the same
```
2020-03-29 13:22:30,161 DEBUG    awx.main.dispatch publish awx.main.tasks.delete_project_files(bfd2b3c1-7c71-4676-a99b-9d1217166f7d, queue=tower_broadcast_all)
RESULT 2
OKREADY
RESULT 2
OKREADY
172.18.0.1 - - [29/Mar/2020:13:24:30 +0000] "DELETE /api/v2/projects/9/ HTTP/1.1" 504 578 "http://xx.yy.zz/" "Mozilla/5.0 (Macintosh; Intel Mac OS X 10_15_3) AppleWebKit/537.36 (KHTML, like Gecko) Chrome/80.0.3987.149 Safari/537.36" "-"
2020/03/29 13:24:30 [error] 122#0: *254 upstream timed out (110: Connection timed out) while reading response header from upstream, client: 172.18.0.1, server: _, request: "DELETE /api/v2/projects/9/ HTTP/1.1", upstream: "uwsgi://127.0.0.1:8050", host: "xx.yy.zz", referrer: "http://xx.yy.zz/"
Sun Mar 29 13:24:30 2020 - *** HARAKIRI ON WORKER 2 (pid: 170, try: 1) ***
Sun Mar 29 13:24:30 2020 - HARAKIRI !!! worker 2 status !!!
Sun Mar 29 13:24:30 2020 - HARAKIRI [core 0] 172.18.0.1 - DELETE /api/v2/projects/9/ since 1585488149
Sun Mar 29 13:24:30 2020 - HARAKIRI !!! end of worker 2 status !!!
DAMN ! worker 2 (pid: 170) died, killed by signal 9 :( trying respawn ...
Respawned uWSGI worker 2 (new pid: 179)
WSGI app 0 (mountpoint='') ready in 2 seconds on interpreter 0xa2d4e0 pid: 179 (default app)
```

**Comment by StepBee** [comment]
After bringing strace into the game, i think i found the reason, but not the solution yet.

the awx_web and awx_task containers are trying to resolve the hostname "none" in a never ending loop until the process gets killed finally.

172.18.0.5 = awx_task
172.18.0.6 = awx_web
cs4cguest.vdc = hosts searchdomain

```
21:49:28.413747 IP 172.18.0.6.53493 > dns.google.domain: 49655+ A? none. (22)
21:49:28.415241 IP dns.google.domain > 172.18.0.6.53493: 49655 NXDomain 0/1/0 (97)
21:49:28.415568 IP 172.18.0.6.37150 > dns.google.domain: 53130+ A? none.. (36)
21:49:28.417099 IP dns.google.domain > 172.18.0.6.37150: 53130 NXDomain 0/1/0 (111)
21:49:28.417502 IP 172.18.0.6.51973 > dns.google.domain: 14776+ AAAA? none. (22)
21:49:28.418783 IP dns.google.domain > 172.18.0.6.51973: 14776 NXDomain 0/1/0 (97)
21:49:28.419036 IP 172.18.0.6.40582 > dns.google.domain: 31766+ AAAA? none.cs4cguest.vdc. (36)
21:49:28.421271 IP dns.google.domain > 172.18.0.6.40582: 31766 NXDomain 0/1/0 (111)
```

```
21:49:35.410306 IP 172.18.0.5.46219 > dns.google.domain: 61862+ A? none. (22)
21:49:35.411691 IP dns.google.domain > 172.18.0.5.46219: 61862 NXDomain 0/1/0 (97)
21:49:35.412024 IP 172.18.0.5.37517 > dns.google.domain: 12507+ A? none.cs4cguest.vdc. (36)
21:49:35.414086 IP dns.google.domain > 172.18.0.5.37517: 12507 NXDomain 0/1/0 (111)
21:49:35.414479 IP 172.18.0.5.49249 > dns.google.domain: 60526+ AAAA? none. (22)
21:49:35.416376 IP dns.google.domain > 172.18.0.5.49249: 60526 NXDomain 0/1/0 (97)
21:49:35.416712 IP 172.18.0.5.60027 > dns.google.domain: 51898+ AAAA? none.cs4cguest.vdc. (36)
21:49:35.417963 IP dns.google.domain > 172.18.0.5.60027: 51898 NXDomain 0/1/0 (111)
```

Looking at [this](https://github.com/ansible/awx/issues/3719) old thread, it looks similar, but not exactly the same, as the memcache hostname config is correct in my installation.
But executing the same command
`echo "from pprint import pprint; pprint(dict((k, getattr(settings, k)) for k in dir(settings)))" | PYTHONIOENCODING=utf8 awx-manage shell_plus | grep None`
 to check for "None" values brings up
```
 'AUTOMATION_ANALYTICS_LAST_GATHER': None,
 'BROKER_POOL_LIMIT': None,
 'BROKER_URL': 'amqp://None:None@None:5672/tower',
                                'CONFIG': {'url': 'amqp://None:None@None:5672/tower'}
```

And i can confirm, that's the issue.
From awx_web and awx_task /etc/tower/settings.py

```
BROKER_URL = 'amqp://{}:{}@{}:{}/{}'.format(
    os.getenv("RABBITMQ_USER", None),
    os.getenv("RABBITMQ_PASSWORD", None),
    os.getenv("RABBITMQ_HOST", None),
    os.getenv("RABBITMQ_PORT", "5672"),
    os.getenv("RABBITMQ_VHOST", "tower"))
```

Changing it to
`    os.getenv("RABBITMQ_HOST", "troubleshooting"),`
results in DNS query loop searching for hostname "troubleshooting"
```
23:27:48.405958 IP 172.18.0.6.42531 > dns.google.domain: 15256+ A? troubleshooting. (33)
23:27:48.407820 IP dns.google.domain > 172.18.0.6.42531: 15256 NXDomain 0/1/0 (108)
23:27:48.408232 IP 172.18.0.6.49055 > dns.google.domain: 4176+ A? troubleshooting.cs4cguest.vdc. (47)
23:27:48.409718 IP dns.google.domain > 172.18.0.6.49055: 4176 NXDomain 0/1/0 (122)
23:27:48.410115 IP 172.18.0.6.48736 > dns.google.domain: 25031+ AAAA? troubleshooting. (33)
23:27:48.411926 IP dns.google.domain > 172.18.0.6.48736: 25031 NXDomain 0/1/0 (108)
23:27:48.412219 IP 172.18.0.6.45088 > dns.google.domain: 15426+ AAAA? troubleshooting.cs4cguest.vdc. (47)
23:27:48.414062 IP dns.google.domain > 172.18.0.6.45088: 15426 NXDomain 0/1/0 (122)
```

As i have no other AWX instance running as a reference - i guess rabbitmq was replaced by redis, but the settings.py does not reflect that? I do have a redis container running, but no rabbitmq container.
```
479507623d18        ansible/awx_task:9.3.0   "/tini -- /bin/sh -c…"   55 minutes ago      Up 4 minutes        8052/tcp               awx_task
f8dddb0fed3f        ansible/awx_web:9.3.0    "/tini -- /bin/sh -c…"   55 minutes ago      Up 4 minutes        0.0.0.0:80->8052/tcp   awx_web
a16febe03875        memcached:alpine         "docker-entrypoint.s…"   9 hours ago         Up About an hour    11211/tcp              awx_memcached
3ee4add1167c        redis                    "docker-entrypoint.s…"   9 hours ago         Up About an hour    6379/tcp               awx_redis
2c24a22fe3ae        postgres:10              "docker-entrypoint.s…"   9 hours ago         Up About an hour    5432/tcp               awx_postgres
```
Finally found the [issue](https://github.com/ansible/awx/issues/5443), announcing the replacement of rabbitmq by redis. This explains it all.
So yes, there is still an issue in the docker compose setup.
Not sure what the correct BROKER_URL should be now?
I tried manually inserting
`BROKER_URL = 'unix:///var/run/redis/redis.sock'`
as mentioned in "awx/settings/defaults.py" but this resulted in
`"No such transport: unix"`

**Comment by jakemcdermott** [comment]
Hello. Sorry you're experiencing difficulty with your awx deployment.

We've been seeing a lot of bug reports mentioning 504s where they're not normally observed. In most cases this is because you've checked out the devel branch and ran an upgrade using container images pulled from docker hub - this won't work currently because we haven't published the containers yet. You'll need to build them yourself or check out a specific tag (e.g. 9.2) before running any installs or upgrades.

**Comment by StepBee** [comment]
@jakemcdermott this were 2 new installations, no upgrade.
The local docker installation of the master branch seems to be broken.
I used a fresh os installation and checkout via
`git clone https://github.com/ansible/awx.git`

**Comment by jakemcdermott** [comment]
> The local docker installation of the master branch

That's correct. That won't be the case in the future but as of right now you'll need to check out a previous tag (e.g 9.1, 9.2) before running any type of install or an upgrade.

**Comment by StepBee** [comment]
> > The local docker installation of the master branch
> 
> That's correct. That won't be the case in the future but as of right now you'll need to check out a previous tag (e.g 9.1, 9.2) before running an install or an upgrade.

ok, thanks for the clarification!

**Comment by jakemcdermott** [comment]
You're welcome! Best of luck.

**Comment by codesupremo** [comment]
I'm getting the same issue as well. How to downgrade from AWX 9.3 to 9.2? Thanks a lot

**Comment by StepBee** [comment]
I haven't gone through downgrades yet and can't advice unfortunately

**Comment by ryanpetrello** [comment]
Alternatively, (instead of what @jakemcdermott recommended), I expect those of you encountering this issue may not experience it by upgrading to (newly released) version 10.0.0.

**Comment by codesupremo** [comment]
Yes, I'm trying to upgrade it now. :) Hopefully, It will work now after the upgrade

**Comment by jakemcdermott** [comment]
Yep, now that the devel branch has been updated so that it works, you can safely ignore https://github.com/ansible/awx/issues/6460#issuecomment-606074560 just do what @ryanpetrello described above. Best of luck!

**Comment by codesupremo** [comment]
Guys, I tried to install the latest release which is 10.0.0. But, AWX is Upgrading (from browser) for like 8hrs now. Did you encounter it? How to resolve it as well?

**Comment by StepBee** [comment]
Yep, i con confirm it'S working like a charm with 10.0.0 fresh installation
