### ISSUE TITLE
Unable to login behing NGINX reverse proxy

### ISSUE THREAD

**Issue by mooky31** [ansible/awx#6180]
##### ISSUE TYPE
 - Bug Report

##### SUMMARY
I set up a NGINX HTTPS reverse proxy to securely access AWX.
I can't login : the UI says invalid username/password

##### ENVIRONMENT
* AWX version: 9.1.1
* AWX install method: docker on linux
* Ansible version:  2.8.5
* Operating System: Debian buster
* Web Browser: Firefox 73.0.1
* Nginx 1.14.2

##### STEPS TO REPRODUCE

Install AWX with docker-compose
Install NGINX

vhost configuration:
server {

    listen 443 ssl http2;

    server_name awx.lab-ansible;

    access_log /var/log/nginx/awx.access.log;
    error_log /var/log/nginx/awx.error.log;

    location / {
        proxy_http_version 1.1;
        proxy_set_header Host $host;
        proxy_set_header X-Real-IP $remote_addr;
        proxy_set_header X-Forwarded-For $proxy_add_x_forwarded_for;
        proxy_set_header X-Forwarded-Proto $scheme;
        proxy_set_header Upgrade $http_upgrade;
        proxy_set_header Connection "upgrade";
        proxy_pass http://127.0.0.1:8080/;
    }

    ssl on;
    ssl_certificate /etc/ssl/certs/nginx-selfsigned.crt;
    ssl_certificate_key /etc/ssl/private/nginx-selfsigned.key;
    ssl_session_timeout 5m;
    ssl_ciphers EECDH+CHACHA20:EECDH+AES128:RSA+AES128:EECDH+AES256:RSA+AES256:EECDH+3DES:RSA+3DES:!MD5;
    ssl_protocols TLSv1.2;
    ssl_prefer_server_ciphers on;

}

##### EXPECTED RESULTS

Login successfull

##### ACTUAL RESULTS

Login refused by the UI, "Invalid username and/or password. Please try again."
HTTP request analysis says: "403 Forbidden, CSRF verification failed"

##### ADDITIONAL INFORMATION
Same config but with reverse proxy http -> http (instead fo https -> http) works
I added HTTP_X_FORWARDED_FOR in remote host headers, didn't change anything.

Tcpdump:
```
15:45:33.108409 IP 127.0.0.1.36092 > 127.0.0.1.8080: Flags [P.], seq 1:2270, ack 1, win 512, options [nop,nop,TS val 388752903 ecr 388752903], length 2269: HTTP: POST /api/login/ HTTP/1.1
E.      .>.@.@...............1..<.9.J...........
.+...+..POST /api/login/ HTTP/1.1
Host: 1.20.20.1
X-Real-IP: 192.168.30.126
X-Forwarded-For: 192.168.30.126
X-Forwarded-Proto: https
Connection: upgrade
Content-Length: 47
user-agent: Mozilla/5.0 (Windows NT 6.3; Win64; x64; rv:73.0) Gecko/20100101 Firefox/73.0
accept: application/json, text/plain, */*
accept-language: en-US,en;q=0.5
accept-encoding: gzip, deflate, br
content-type: application/x-www-form-urlencoded
x-requested-with: XMLHttpRequest
x-csrftoken: ejYjWAQN04VDFzTZNLehKNZe0T2q683MJpCEQo8PO0jSL3cHiDqHnm8v6anSsea6
origin: https://1.20.20.1:12143
referer: https://1.20.20.1:12143/
pragma: no-cache
cache-control: no-cache
cookie: csrftoken=ejYjWAQN04VDFzTZNLehKNZe0T2q683MJpCEQo8PO0jSL3cHiDqHnm8v6anSsea6; sessionExpired=false; lastPath=%2Fhome; current_user=%7B%22id%22%3A2%2C%22type%22%3A%22user%22%2C%22url%2
2%3A%22%2Fapi%2Fv2%2Fusers%2F2%2F%22%2C%22related%22%3A%7B%22teams%22%3A%22%2Fapi%2Fv2%2Fusers%2F2%2Fteams%2F%22%2C%22organizations%22%3A%22%2Fapi%2Fv2%2Fusers%2F2%2Forganizations%2F%22%2C%
22admin_of_organizations%22%3A%22%2Fapi%2Fv2%2Fusers%2F2%2Fadmin_of_organizations%2F%22%2C%22projects%22%3A%22%2Fapi%2Fv2%2Fusers%2F2%2Fprojects%2F%22%2C%22credentials%22%3A%22%2Fapi%2Fv2%2
Fusers%2F2%2Fcredentials%2F%22%2C%22roles%22%3A%22%2Fapi%2Fv2%2Fusers%2F2%2Froles%2F%22%2C%22activity_stream%22%3A%22%2Fapi%2Fv2%2Fusers%2F2%2Factivity_stream%2F%22%2C%22access_list%22%3A%2
2%2Fapi%2Fv2%2Fusers%2F2%2Faccess_list%2F%22%2C%22tokens%22%3A%22%2Fapi%2Fv2%2Fusers%2F2%2Ftokens%2F%22%2C%22authorized_tokens%22%3A%22%2Fapi%2Fv2%2Fusers%2F2%2Fauthorized_tokens%2F%22%2C%2
2personal_tokens%22%3A%22%2Fapi%2Fv2%2Fusers%2F2%2Fpersonal_tokens%2F%22%7D%2C%22summary_fields%22%3A%7B%22user_capabilities%22%3A%7B%22edit%22%3Atrue%2C%22delete%22%3Afalse%7D%7D%2C%22crea
ted%22%3A%222020-01-22T08%3A52%3A28.497145Z%22%2C%22username%22%3A%22admin%22%2C%22first_name%22%3A%22%22%2C%22last_name%22%3A%22%22%2C%22email%22%3A%22root%40localhost%22%2C%22is_superuser
%22%3Atrue%2C%22is_system_auditor%22%3Afalse%2C%22ldap_dn%22%3A%22%22%2C%22last_login%22%3A%222020-03-05T14%3A44%3A42.318039Z%22%2C%22external_account%22%3Anull%2C%22auth%22%3A%5B%5D%7D; se
ssionid=9f0ad3awpufxbncfaobasewvl7a6j169; userLoggedIn=true

username=admin&password=password&next=%2fapi%2f
15:45:33.108416 IP 127.0.0.1.8080 > 127.0.0.1.36092: Flags [.], ack 2270, win 500, options [nop,nop,TS val 388752903 ecr 388752903], length 0
E..4..@.@.40.............9.J1.
......(.....
.+...+..
15:45:33.264374 IP 127.0.0.1.8080 > 127.0.0.1.36092: Flags [P.], seq 1:1422, ack 2270, win 512, options [nop,nop,TS val 388753059 ecr 388752903], length 1421: HTTP: HTTP/1.1 403 Forbidden
E.....@.@................9.J1.
............
.+...+..HTTP/1.1 403 Forbidden
Server: nginx
Date: Thu, 05 Mar 2020 14:45:33 GMT
Content-Type: text/html
Content-Length: 1019
Connection: keep-alive
Session-Timeout: 86400
Vary: Accept-Language, Origin, Cookie
Content-Language: en
X-API-Total-Time: 0.154s
Set-Cookie: sessionid=9f0ad3awpufxbncfaobasewvl7a6j169; expires=Fri, 06 Mar 2020 14:45:33 GMT; HttpOnly; Max-Age=86400; Path=/; SameSite=Lax


<!DOCTYPE html>
<html lang="en">
<head>
  <meta http-equiv="content-type" content="text/html; charset=utf-8">
  <meta name="robots" content="NONE,NOARCHIVE">
  <title>403 Forbidden</title>
  <style type="text/css">
    html * { padding:0; margin:0; }
    body * { padding:10px 20px; }
    body * * { padding:0; }
    body { font:small sans-serif; background:#eee; color:#000; }
    body>div { border-bottom:1px solid #ddd; }
    h1 { font-weight:normal; margin-bottom:.4em; }
    h1 span { font-size:60%; color:#666; font-weight:normal; }
    #info { background:#f6f6f6; }
    #info ul { margin: 0.5em 4em; }
    #info p, #summary p { padding-top:10px; }
    #summary { background: #ffc; }
    #explanation { background:#eee; border-bottom: 0px none; }
  </style>
</head>
<body>
<div id="summary">
  <h1>Forbidden <span>(403)</span></h1>
  <p>CSRF verification failed. Request aborted.</p>


</div>

<div id="explanation">
  <p><small>More information is available with DEBUG=True.</small></p>
</div>

</body>
</html>
```

**Comment by ryanpetrello** [comment]
Hey @mooky31,

This issue tracker is for tracking feature enhancements and bugs to AWX itself.

I know we've got users that have successfully gotten this working with various versions of AWX, and our community is generally happy to provide pointers for troubleshooting this sort of thing.  If you need help troubleshooting an AWX install, try our mailing list or IRC channel instead:

http://webchat.freenode.net/?channels=ansible-awx
https://groups.google.com/forum/#!forum/awx-project

**Comment by mamivl** [comment]
Thanks for your response on Google groups, it worked for me! I use awx on a server that is in proxmox! I use nginx as a reverse proxy for HTTPS and access from outside.
Awx 17.0.1
Ansible 2.10
Docker 24.0.6
Nginx 1.18.0
